for master_1
for child2
child2_1
child2_2
child2_3
for child3
child3_1
child3_2
child3_3

drop and create databases
connection master_1;
DROP DATABASE IF EXISTS auto_test_local;
SET @old_log_output = @@global.log_output;
SET @old_log_output1 = @@global.spider_general_log;
SET GLOBAL log_output = 'TABLE,FILE';
set global spider_general_log=1;
TRUNCATE TABLE mysql.general_log;
CREATE DATABASE auto_test_local;
USE auto_test_local;
connection child2_1;
DROP DATABASE IF EXISTS auto_test_remote;
CREATE DATABASE auto_test_remote;
USE auto_test_remote;
connection child2_2;
DROP DATABASE IF EXISTS auto_test_remote_2;
CREATE DATABASE auto_test_remote_2;
USE auto_test_remote_2;

create table for child
connection child2_1;
CHILD2_1_DROP_TABLES
CHILD2_1_CREATE_TABLES
SET @old_log_output = @@global.log_output;
TRUNCATE TABLE mysql.general_log;
set global log_output = 'TABLE';
connection child2_2;
CHILD2_2_DROP_TABLES
CHILD2_2_CREATE_TABLES
SET @old_log_output = @@global.log_output;
TRUNCATE TABLE mysql.general_log;
set global log_output = 'TABLE';

create table for master
connection master_1;
DROP TABLE IF EXISTS ta_l;
CREATE TABLE tbl_a (
`id` int(11) NOT NULL,
`c1` int(11) DEFAULT NULL,
`update_time` timestamp NOT NULL DEFAULT CURRENT_TIMESTAMP ON UPDATE CURRENT_TIMESTAMP,
PRIMARY KEY (`id`)
) ENGINE=Spider  PARTITION BY LIST (crc32(id)%2)
(PARTITION pt0 VALUES IN (0) COMMENT = 'database "auto_test_remote", table "tbl_a", srv "s_2_1",aim "0"',
PARTITION pt1 VALUES IN (1) COMMENT = 'database "auto_test_remote_2", table "tbl_a", srv "s_2_2",aim "1"');
show create table tbl_a;
Table	Create Table
tbl_a	CREATE TABLE `tbl_a` (
  `id` int(11) NOT NULL,
  `c1` int(11) DEFAULT NULL,
  `update_time` timestamp NOT NULL DEFAULT CURRENT_TIMESTAMP ON UPDATE CURRENT_TIMESTAMP,
  PRIMARY KEY (`id`)
) ENGINE=SPIDER DEFAULT CHARSET=latin1
 PARTITION BY LIST (crc32(`id`) MOD 2)
(PARTITION `pt0` VALUES IN (0) COMMENT = 'database "auto_test_remote", table "tbl_a", srv "s_2_1",aim "0"' ENGINE = SPIDER,
 PARTITION `pt1` VALUES IN (1) COMMENT = 'database "auto_test_remote_2", table "tbl_a", srv "s_2_2",aim "1"' ENGINE = SPIDER)
TRUNCATE TABLE mysql.general_log;

direct_update
update tbl_a  set c1 = 2 where id = 1;
SELECT argument FROM mysql.general_log;
argument
update tbl_a  set c1 = 2 where id = 1
mysql localhost set session transaction isolation level repeatable read;set session autocommit = 1;set session time_zone = 'SYSTEM'
mysql localhost update `auto_test_remote_2`.`tbl_a` set `c1` = 2 where (`id` = 1)
SELECT argument FROM mysql.general_log
set timestamp=unix_timestamp('2001-02-03 10:20:30');
TRUNCATE TABLE mysql.general_log;

direct_update
replace into tbl_a(id, c1) values(1,2);
SELECT argument FROM mysql.general_log;
argument
replace into tbl_a(id, c1) values(1,2)
mysql localhost replace into `auto_test_remote_2`.`tbl_a`(`id`,`c1`,`update_time`)values(1,2,'2001-02-03 10:20:30')
SELECT argument FROM mysql.general_log
TRUNCATE TABLE mysql.general_log;

no direct_update
update tbl_a set c1 = 2 where id = 1;
SELECT argument FROM mysql.general_log;
argument
update tbl_a set c1 = 2 where id = 1
mysql localhost select `id`,`c1`,`update_time` from `auto_test_remote_2`.`tbl_a` where `id` = 1 and (`id` = 1) for update
SELECT argument FROM mysql.general_log

deinit
connection master_1;
DROP DATABASE IF EXISTS auto_test_local;
SET GLOBAL log_output = @old_log_output;
SET GLOBAL spider_general_log = @old_log_output1;
connection child2_1;
DROP DATABASE IF EXISTS auto_test_remote;
SET GLOBAL log_output = @old_log_output;
connection child2_2;
DROP DATABASE IF EXISTS auto_test_remote_2;
SET GLOBAL log_output = @old_log_output;
for master_1
for child2
child2_1
child2_2
child2_3
for child3
child3_1
child3_2
child3_3

end of test
