for master_1
for child2
child2_1
child2_2
child2_3
for child3
child3_1
child3_2
child3_3

drop and create databases
connection master_1;
DROP DATABASE IF EXISTS auto_test_local;
CREATE DATABASE auto_test_local;
USE auto_test_local;
connection child2_1;
DROP DATABASE IF EXISTS auto_test_remote;
CREATE DATABASE auto_test_remote;
USE auto_test_remote;
connection child2_2;
DROP DATABASE IF EXISTS auto_test_remote_2;
CREATE DATABASE auto_test_remote_2;
USE auto_test_remote_2;

create table for child
connection child2_1;
CHILD2_1_DROP_TABLES
CHILD2_1_CREATE_TABLES
connection child2_2;
CHILD2_2_DROP_TABLES
CHILD2_2_CREATE_TABLES

create table for master
connection master_1;
DROP TABLE IF EXISTS t1;;
CREATE TABLE t1 (id INT primary key, a INT, b BLOB)ENGINE=Spider DEFAULT CHARSET=utf8 PARTITION BY LIST (id % 2)( PARTITION `pt0` VALUES IN (0) COMMENT = 'database "auto_test_remote", table "t1", srv "s_2_1",aim "0"', PARTITION `pt1` VALUES IN (1) COMMENT = 'database "auto_test_remote_2", table "t1", srv "s_2_2",aim "1"');;

test
connection master_1;
INSERT INTO t1 VALUES(61,76,'b1'), (60,33,'b2'), (24,75,'b3'), (63,76,'b4');
SELECT * FROM t1 ORDER BY id;
id	a	b
24	75	b3
60	33	b2
61	76	b1
63	76	b4
update t1 set id = 68 where id = 60;
SELECT * FROM t1 ORDER BY id;
id	a	b
24	75	b3
61	76	b1
63	76	b4
68	33	b2
update t1 set id = 67 where id = 61;
SELECT * FROM t1 ORDER BY id;
id	a	b
24	75	b3
63	76	b4
67	76	b1
68	33	b2
update t1 set b = 'b5' where id = 24;
SELECT * FROM t1 ORDER BY id;
id	a	b
24	75	b5
63	76	b4
67	76	b1
68	33	b2
update t1 set b = 'b6' where b = 'b4';
SELECT * FROM t1 ORDER BY id;
id	a	b
24	75	b5
63	76	b6
67	76	b1
68	33	b2

create table for child
connection child2_1;
CHILD2_1_DROP_TABLES
CHILD2_1_CREATE_TABLES
connection child2_2;
CHILD2_2_DROP_TABLES
CHILD2_2_CREATE_TABLES

create table for master
connection master_1;
DROP TABLE IF EXISTS t2;;
CREATE TABLE t2 (id INT primary key, a INT, b BLOB, f FLOAT)ENGINE=Spider DEFAULT CHARSET=utf8 PARTITION BY LIST (id % 2)( PARTITION `pt0` VALUES IN (0) COMMENT = 'database "auto_test_remote", table "t2", srv "s_2_1",aim "0"', PARTITION `pt1` VALUES IN (1) COMMENT = 'database "auto_test_remote_2", table "t2", srv "s_2_2",aim "1"');;
INSERT INTO t2 VALUES(61,76,'b1',4.86947), (60,33,'b2',0), (24,75,'b3',4.61755), (63,76,'b4',4.86947);
update t2 set id = 68 where id = 60;
SELECT * FROM t2 ORDER BY id;
id	a	b	f
24	75	b3	4.61755
61	76	b1	4.86947
63	76	b4	4.86947
68	33	b2	0
update t2 set id = 67 where id = 61;
SELECT * FROM t2 ORDER BY id;
id	a	b	f
24	75	b3	4.61755
63	76	b4	4.86947
67	76	b1	4.86947
68	33	b2	0
update t2 set b = 'b5' where id = 24;
SELECT * FROM t2 ORDER BY id;
id	a	b	f
24	75	b5	4.61755
63	76	b4	4.86947
67	76	b1	4.86947
68	33	b2	0
update t2 set b = 'b6' where b = 'b4';
SELECT * FROM t2 ORDER BY id;
id	a	b	f
24	75	b5	4.61755
63	76	b6	4.86947
67	76	b1	4.86947
68	33	b2	0
update t2 set f = 4.86946 where id = 24;
SELECT * FROM t2 ORDER BY id;
id	a	b	f
24	75	b5	4.86946
63	76	b6	4.86947
67	76	b1	4.86947
68	33	b2	0
update t2 set f = 4.86948 where b = 'b6';
SELECT * FROM t2 ORDER BY id;
id	a	b	f
24	75	b5	4.86946
63	76	b6	4.86948
67	76	b1	4.86947
68	33	b2	0

create table for child
connection child2_1;
CHILD2_1_DROP_TABLES
CHILD2_1_CREATE_TABLES
connection child2_2;
CHILD2_2_DROP_TABLES
CHILD2_2_CREATE_TABLES

create table for master
connection master_1;
DROP TABLE IF EXISTS t3;;
CREATE TABLE t3 (id INT unique key, a INT, b BLOB)ENGINE=Spider DEFAULT CHARSET=utf8 PARTITION BY LIST (id % 2)( PARTITION `pt0` VALUES IN (0) COMMENT = 'database "auto_test_remote", table "t3", srv "s_2_1",aim "0"', PARTITION `pt1` VALUES IN (1) COMMENT = 'database "auto_test_remote_2", table "t3", srv "s_2_2",aim "1"');;
INSERT INTO t3 VALUES(61,76,'b1'), (60,33,'b2'), (24,75,'b3'), (63,76,'b4');
update t3 set id = 68 where id = 60;
SELECT * FROM t3 ORDER BY id;
id	a	b
24	75	b3
61	76	b1
63	76	b4
68	33	b2
update t3 set id = 67 where id = 61;
SELECT * FROM t3 ORDER BY id;
id	a	b
24	75	b3
63	76	b4
67	76	b1
68	33	b2
update t3 set b = 'b5' where id = 24;
SELECT * FROM t3 ORDER BY id;
id	a	b
24	75	b5
63	76	b4
67	76	b1
68	33	b2
update t3 set b = 'b6' where b = 'b4';
SELECT * FROM t3 ORDER BY id;
id	a	b
24	75	b5
63	76	b6
67	76	b1
68	33	b2

create table for child
connection child2_1;
CHILD2_1_DROP_TABLES
CHILD2_1_CREATE_TABLES
connection child2_2;
CHILD2_2_DROP_TABLES
CHILD2_2_CREATE_TABLES

create table for master
connection master_1;
DROP TABLE IF EXISTS t4;;
CREATE TABLE t4 (id INT unique key, a INT, b BLOB, f FLOAT)ENGINE=Spider DEFAULT CHARSET=utf8 PARTITION BY LIST (id % 2)( PARTITION `pt0` VALUES IN (0) COMMENT = 'database "auto_test_remote", table "t4", srv "s_2_1",aim "0"', PARTITION `pt1` VALUES IN (1) COMMENT = 'database "auto_test_remote_2", table "t4", srv "s_2_2",aim "1"');;
INSERT INTO t4 VALUES(61,76,'b1',4.86947), (60,33,'b2',0), (24,75,'b3',4.61755), (63,76,'b4',4.86947);
update t4 set id = 68 where id = 60;
SELECT * FROM t4 ORDER BY id;
id	a	b	f
24	75	b3	4.61755
61	76	b1	4.86947
63	76	b4	4.86947
68	33	b2	0
update t4 set id = 67 where id = 61;
SELECT * FROM t4 ORDER BY id;
id	a	b	f
24	75	b3	4.61755
63	76	b4	4.86947
67	76	b1	4.86947
68	33	b2	0
update t4 set b = 'b5' where id = 24;
SELECT * FROM t4 ORDER BY id;
id	a	b	f
24	75	b5	4.61755
63	76	b4	4.86947
67	76	b1	4.86947
68	33	b2	0
update t4 set b = 'b6' where b = 'b4';
SELECT * FROM t4 ORDER BY id;
id	a	b	f
24	75	b5	4.61755
63	76	b6	4.86947
67	76	b1	4.86947
68	33	b2	0
update t4 set f = 4.86946 where id = 24;
SELECT * FROM t4 ORDER BY id;
id	a	b	f
24	75	b5	4.86946
63	76	b6	4.86947
67	76	b1	4.86947
68	33	b2	0
update t4 set f = 4.86948 where b = 'b6';
SELECT * FROM t4 ORDER BY id;
id	a	b	f
24	75	b5	4.86946
63	76	b6	4.86948
67	76	b1	4.86947
68	33	b2	0

create table for child
connection child2_1;
CHILD2_1_DROP_TABLES
CHILD2_1_CREATE_TABLES
connection child2_2;
CHILD2_2_DROP_TABLES
CHILD2_2_CREATE_TABLES

create table for master
connection master_1;
DROP TABLE IF EXISTS t5;;
CREATE TABLE t5 (id INT, a INT, b BLOB, KEY kid(id))ENGINE=Spider DEFAULT CHARSET=utf8 PARTITION BY LIST (id % 2)( PARTITION `pt0` VALUES IN (0) COMMENT = 'database "auto_test_remote", table "t5", srv "s_2_1",aim "0"', PARTITION `pt1` VALUES IN (1) COMMENT = 'database "auto_test_remote_2", table "t5", srv "s_2_2",aim "1"');;
INSERT INTO t5 VALUES(61,76,'b1'), (60,33,'b2'), (24,75,'b3'), (63,76,'b4');
SELECT * FROM t5 ORDER BY id;
id	a	b
24	75	b3
60	33	b2
61	76	b1
63	76	b4
update t5 set id = 68 where id = 60;
SELECT * FROM t5 ORDER BY id;
id	a	b
24	75	b3
61	76	b1
63	76	b4
68	33	b2
update t5 set id = 67 where id = 61;
SELECT * FROM t5 ORDER BY id;
id	a	b
24	75	b3
63	76	b4
67	76	b1
68	33	b2
update t5 set b = 'b5' where id = 24;
SELECT * FROM t5 ORDER BY id;
id	a	b
24	75	b5
63	76	b4
67	76	b1
68	33	b2
update t5 set b = 'b6' where b = 'b4';
SELECT * FROM t5 ORDER BY id;
id	a	b
24	75	b5
63	76	b6
67	76	b1
68	33	b2

create table for child
connection child2_1;
CHILD2_1_DROP_TABLES
CHILD2_1_CREATE_TABLES
connection child2_2;
CHILD2_2_DROP_TABLES
CHILD2_2_CREATE_TABLES

create table for master
connection master_1;
DROP TABLE IF EXISTS t6;;
CREATE TABLE t6 (id INT, a INT, b BLOB, f FLOAT)ENGINE=Spider DEFAULT CHARSET=utf8 PARTITION BY LIST (id % 2)( PARTITION `pt0` VALUES IN (0) COMMENT = 'database "auto_test_remote", table "t6", srv "s_2_1",aim "0"', PARTITION `pt1` VALUES IN (1) COMMENT = 'database "auto_test_remote_2", table "t6", srv "s_2_2",aim "1"');;
INSERT INTO t6 VALUES(61,76,'b1',4.86947), (60,33,'b2',0), (24,75,'b3',4.61755), (63,76,'b4',4.86947);
update t6 set id = 68 where id = 60;
SELECT * FROM t6 ORDER BY id;
id	a	b	f
24	75	b3	4.61755
61	76	b1	4.86947
63	76	b4	4.86947
68	33	b2	0
update t6 set id = 67 where id = 61;
SELECT * FROM t6 ORDER BY id;
id	a	b	f
24	75	b3	4.61755
63	76	b4	4.86947
67	76	b1	4.86947
68	33	b2	0
update t6 set id = 25 where id = 24;
SELECT * FROM t6 ORDER BY id;
id	a	b	f
25	75	b3	4.61755
63	76	b4	4.86947
67	76	b1	4.86947
68	33	b2	0
update t6 set b = 'b5' where id = 24;
SELECT * FROM t6 ORDER BY id;
id	a	b	f
25	75	b3	4.61755
63	76	b4	4.86947
67	76	b1	4.86947
68	33	b2	0
update t6 set b = 'b6' where b = 'b4';
SELECT * FROM t6 ORDER BY id;
id	a	b	f
25	75	b3	4.61755
63	76	b6	4.86947
67	76	b1	4.86947
68	33	b2	0
update t6 set f = 4.86946 where id = 25;
SELECT * FROM t6 ORDER BY id;
id	a	b	f
25	75	b3	4.86946
63	76	b6	4.86947
67	76	b1	4.86947
68	33	b2	0
update t6 set f = 4.86948 where b = 'b6';
SELECT * FROM t6 ORDER BY id;
id	a	b	f
25	75	b3	4.86946
63	76	b6	4.86948
67	76	b1	4.86947
68	33	b2	0

create table for child
connection child2_1;
CHILD2_1_DROP_TABLES
CHILD2_1_CREATE_TABLES
connection child2_2;
CHILD2_2_DROP_TABLES
CHILD2_2_CREATE_TABLES

create table for master
connection master_1;
DROP TABLE IF EXISTS t7;;
CREATE TABLE t7 (id1 INT, id2 INT, a INT, b BLOB, PRIMARY KEY(id1, id2))ENGINE=Spider DEFAULT CHARSET=utf8 PARTITION BY LIST (id1 % 2)( PARTITION `pt0` VALUES IN (0) COMMENT = 'database "auto_test_remote", table "t7", srv "s_2_1",aim "0"', PARTITION `pt1` VALUES IN (1) COMMENT = 'database "auto_test_remote_2", table "t7", srv "s_2_2",aim "1"');;
INSERT INTO t7 VALUES(61,61,76,'b1'), (61,62,76,'b2'), (60,60,33,'b3'), (24,24,75,'b3'), (25,24,75,'b5'), (63,63,76,'b4');
SELECT * FROM t7 ORDER BY id1, id2;
id1	id2	a	b
24	24	75	b3
25	24	75	b5
60	60	33	b3
61	61	76	b1
61	62	76	b2
63	63	76	b4
update t7 set id1 = 65 where id1 = 61;
SELECT * FROM t7 ORDER BY id1, id2;
id1	id2	a	b
24	24	75	b3
25	24	75	b5
60	60	33	b3
63	63	76	b4
65	61	76	b1
65	62	76	b2
update t7 set id1 = 64 where id1 = 60;
SELECT * FROM t7 ORDER BY id1, id2;
id1	id2	a	b
24	24	75	b3
25	24	75	b5
63	63	76	b4
64	60	33	b3
65	61	76	b1
65	62	76	b2
update t7 set id1 = 67 where id1 = 65;
SELECT * FROM t7 ORDER BY id1, id2;
id1	id2	a	b
24	24	75	b3
25	24	75	b5
63	63	76	b4
64	60	33	b3
67	61	76	b1
67	62	76	b2
update t7 set id1 = 68 where id1 = 63;
SELECT * FROM t7 ORDER BY id1, id2;
id1	id2	a	b
24	24	75	b3
25	24	75	b5
64	60	33	b3
67	61	76	b1
67	62	76	b2
68	63	76	b4
update t7 set b = 'b5' where id1 = 24;
SELECT * FROM t7 ORDER BY id1, id2;
id1	id2	a	b
24	24	75	b5
25	24	75	b5
64	60	33	b3
67	61	76	b1
67	62	76	b2
68	63	76	b4
update t7 set b = 'b7' where id2 = 63;
SELECT * FROM t7 ORDER BY id1, id2;
id1	id2	a	b
24	24	75	b5
25	24	75	b5
64	60	33	b3
67	61	76	b1
67	62	76	b2
68	63	76	b7
update t7 set b = 'b6' where id1 = 64 and id2 = 60;
SELECT * FROM t7 ORDER BY id1, id2;
id1	id2	a	b
24	24	75	b5
25	24	75	b5
64	60	33	b6
67	61	76	b1
67	62	76	b2
68	63	76	b7
update t7 set b = 'b6' where b = 'b7';
SELECT * FROM t7 ORDER BY id1, id2;
id1	id2	a	b
24	24	75	b5
25	24	75	b5
64	60	33	b6
67	61	76	b1
67	62	76	b2
68	63	76	b6

create table for child
connection child2_1;
CHILD2_1_DROP_TABLES
CHILD2_1_CREATE_TABLES
connection child2_2;
CHILD2_2_DROP_TABLES
CHILD2_2_CREATE_TABLES

create table for master
connection master_1;
DROP TABLE IF EXISTS t8;;
CREATE TABLE t8 (id1 INT, id2 INT, a INT, b BLOB, f FLOAT, PRIMARY KEY(id1, id2))ENGINE=Spider DEFAULT CHARSET=utf8 PARTITION BY LIST (id1 % 2)( PARTITION `pt0` VALUES IN (0) COMMENT = 'database "auto_test_remote", table "t8", srv "s_2_1",aim "0"', PARTITION `pt1` VALUES IN (1) COMMENT = 'database "auto_test_remote_2", table "t8", srv "s_2_2",aim "1"');;
INSERT INTO t8 VALUES(61,61,76,'b1',4.86947), (61,62,76,'b2',4.61755), (60,60,33,'b3',4.61755), (24,24,75,'b3',0), (25,24,75,'b5',0), (63,63,76,'b4',4.86947);
update t8 set id1 = 65 where id1 = 61;
SELECT * FROM t8 ORDER BY id1, id2;
id1	id2	a	b	f
24	24	75	b3	0
25	24	75	b5	0
60	60	33	b3	4.61755
63	63	76	b4	4.86947
65	61	76	b1	4.86947
65	62	76	b2	4.61755
update t8 set id1 = 64 where id1 = 60;
SELECT * FROM t8 ORDER BY id1, id2;
id1	id2	a	b	f
24	24	75	b3	0
25	24	75	b5	0
63	63	76	b4	4.86947
64	60	33	b3	4.61755
65	61	76	b1	4.86947
65	62	76	b2	4.61755
update t8 set id1 = 67 where id1 = 65;
SELECT * FROM t8 ORDER BY id1, id2;
id1	id2	a	b	f
24	24	75	b3	0
25	24	75	b5	0
63	63	76	b4	4.86947
64	60	33	b3	4.61755
67	61	76	b1	4.86947
67	62	76	b2	4.61755
update t8 set id1 = 68 where id1 = 63;
SELECT * FROM t8 ORDER BY id1, id2;
id1	id2	a	b	f
24	24	75	b3	0
25	24	75	b5	0
64	60	33	b3	4.61755
67	61	76	b1	4.86947
67	62	76	b2	4.61755
68	63	76	b4	4.86947
update t8 set b = 'b5' where id1 = 24;
SELECT * FROM t8 ORDER BY id1, id2;
id1	id2	a	b	f
24	24	75	b5	0
25	24	75	b5	0
64	60	33	b3	4.61755
67	61	76	b1	4.86947
67	62	76	b2	4.61755
68	63	76	b4	4.86947
update t8 set b = 'b7' where id2 = 63;
SELECT * FROM t8 ORDER BY id1, id2;
id1	id2	a	b	f
24	24	75	b5	0
25	24	75	b5	0
64	60	33	b3	4.61755
67	61	76	b1	4.86947
67	62	76	b2	4.61755
68	63	76	b7	4.86947
update t8 set b = 'b6' where id1 = 64 and id2 = 60;
SELECT * FROM t8 ORDER BY id1, id2;
id1	id2	a	b	f
24	24	75	b5	0
25	24	75	b5	0
64	60	33	b6	4.61755
67	61	76	b1	4.86947
67	62	76	b2	4.61755
68	63	76	b7	4.86947
update t8 set f = 2.33333 where id1 = 64 and id2 = 60;
SELECT * FROM t8 ORDER BY id1, id2;
id1	id2	a	b	f
24	24	75	b5	0
25	24	75	b5	0
64	60	33	b6	2.33333
67	61	76	b1	4.86947
67	62	76	b2	4.61755
68	63	76	b7	4.86947
update t8 set b = 'b6' where b = 'b7';
SELECT * FROM t8 ORDER BY id1, id2;
id1	id2	a	b	f
24	24	75	b5	0
25	24	75	b5	0
64	60	33	b6	2.33333
67	61	76	b1	4.86947
67	62	76	b2	4.61755
68	63	76	b6	4.86947
update t8 set f = 6.66666 where b = 'b6';
SELECT * FROM t8 ORDER BY id1, id2;
id1	id2	a	b	f
24	24	75	b5	0
25	24	75	b5	0
64	60	33	b6	6.66666
67	61	76	b1	4.86947
67	62	76	b2	4.61755
68	63	76	b6	6.66666

create table for child
connection child2_1;
CHILD2_1_DROP_TABLES
CHILD2_1_CREATE_TABLES
connection child2_2;
CHILD2_2_DROP_TABLES
CHILD2_2_CREATE_TABLES

create table for master
connection master_1;
DROP TABLE IF EXISTS t9;;
CREATE TABLE t9 (id1 INT, id2 INT, a INT, b BLOB, PRIMARY KEY(id1, id2))ENGINE=Spider DEFAULT CHARSET=utf8 PARTITION BY LIST (id1 % 2)( PARTITION `pt0` VALUES IN (0) COMMENT = 'database "auto_test_remote", table "t9", srv "s_2_1",aim "0"', PARTITION `pt1` VALUES IN (1) COMMENT = 'database "auto_test_remote_2", table "t9", srv "s_2_2",aim "1"');;
INSERT INTO t9 VALUES(61,61,76,'b1'), (61,62,76,'b2'), (60,60,33,'b3'), (24,24,75,'b3'), (25,24,75,'b5'), (63,63,76,'b4');
SELECT * FROM t9 ORDER BY id1, id2;
id1	id2	a	b
24	24	75	b3
25	24	75	b5
60	60	33	b3
61	61	76	b1
61	62	76	b2
63	63	76	b4
update t9 set id1 = 65 where id1 = 61;
SELECT * FROM t9 ORDER BY id1, id2;
id1	id2	a	b
24	24	75	b3
25	24	75	b5
60	60	33	b3
63	63	76	b4
65	61	76	b1
65	62	76	b2
update t9 set id1 = 64 where id1 = 60;
SELECT * FROM t9 ORDER BY id1, id2;
id1	id2	a	b
24	24	75	b3
25	24	75	b5
63	63	76	b4
64	60	33	b3
65	61	76	b1
65	62	76	b2
update t9 set id1 = 67 where id1 = 65;
SELECT * FROM t9 ORDER BY id1, id2;
id1	id2	a	b
24	24	75	b3
25	24	75	b5
63	63	76	b4
64	60	33	b3
67	61	76	b1
67	62	76	b2
update t9 set id1 = 68 where id1 = 63;
SELECT * FROM t9 ORDER BY id1, id2;
id1	id2	a	b
24	24	75	b3
25	24	75	b5
64	60	33	b3
67	61	76	b1
67	62	76	b2
68	63	76	b4
update t9 set b = 'b5' where id1 = 24;
SELECT * FROM t9 ORDER BY id1, id2;
id1	id2	a	b
24	24	75	b5
25	24	75	b5
64	60	33	b3
67	61	76	b1
67	62	76	b2
68	63	76	b4
update t9 set b = 'b7' where id2 = 63;
SELECT * FROM t9 ORDER BY id1, id2;
id1	id2	a	b
24	24	75	b5
25	24	75	b5
64	60	33	b3
67	61	76	b1
67	62	76	b2
68	63	76	b7
update t9 set b = 'b6' where id1 = 64 and id2 = 60;
SELECT * FROM t9 ORDER BY id1, id2;
id1	id2	a	b
24	24	75	b5
25	24	75	b5
64	60	33	b6
67	61	76	b1
67	62	76	b2
68	63	76	b7
update t9 set b = 'b6' where b = 'b7';
SELECT * FROM t9 ORDER BY id1, id2;
id1	id2	a	b
24	24	75	b5
25	24	75	b5
64	60	33	b6
67	61	76	b1
67	62	76	b2
68	63	76	b6

create table for child
connection child2_1;
CHILD2_1_DROP_TABLES
CHILD2_1_CREATE_TABLES
connection child2_2;
CHILD2_2_DROP_TABLES
CHILD2_2_CREATE_TABLES

create table for master
connection master_1;
DROP TABLE IF EXISTS t10;;
CREATE TABLE t10 (id1 INT, id2 INT, a INT, b BLOB, f FLOAT, PRIMARY KEY(id1, id2))ENGINE=Spider DEFAULT CHARSET=utf8 PARTITION BY LIST (id1 % 2)( PARTITION `pt0` VALUES IN (0) COMMENT = 'database "auto_test_remote", table "t10", srv "s_2_1",aim "0"', PARTITION `pt1` VALUES IN (1) COMMENT = 'database "auto_test_remote_2", table "t10", srv "s_2_2",aim "1"');;
INSERT INTO t10 VALUES(61,61,76,'b1',4.86947), (61,62,76,'b2',4.61755), (60,60,33,'b3',4.61755), (24,24,75,'b3',0), (25,24,75,'b5',0), (63,63,76,'b4',4.86947);
update t10 set id1 = 65 where id1 = 61;
SELECT * FROM t10 ORDER BY id1, id2;
id1	id2	a	b	f
24	24	75	b3	0
25	24	75	b5	0
60	60	33	b3	4.61755
63	63	76	b4	4.86947
65	61	76	b1	4.86947
65	62	76	b2	4.61755
update t10 set id1 = 64 where id1 = 60;
SELECT * FROM t10 ORDER BY id1, id2;
id1	id2	a	b	f
24	24	75	b3	0
25	24	75	b5	0
63	63	76	b4	4.86947
64	60	33	b3	4.61755
65	61	76	b1	4.86947
65	62	76	b2	4.61755
update t10 set id1 = 67 where id1 = 65;
SELECT * FROM t10 ORDER BY id1, id2;
id1	id2	a	b	f
24	24	75	b3	0
25	24	75	b5	0
63	63	76	b4	4.86947
64	60	33	b3	4.61755
67	61	76	b1	4.86947
67	62	76	b2	4.61755
update t10 set id1 = 68 where id1 = 63;
SELECT * FROM t10 ORDER BY id1, id2;
id1	id2	a	b	f
24	24	75	b3	0
25	24	75	b5	0
64	60	33	b3	4.61755
67	61	76	b1	4.86947
67	62	76	b2	4.61755
68	63	76	b4	4.86947
update t10 set b = 'b5' where id1 = 24;
SELECT * FROM t10 ORDER BY id1, id2;
id1	id2	a	b	f
24	24	75	b5	0
25	24	75	b5	0
64	60	33	b3	4.61755
67	61	76	b1	4.86947
67	62	76	b2	4.61755
68	63	76	b4	4.86947
update t10 set b = 'b7' where id2 = 63;
SELECT * FROM t10 ORDER BY id1, id2;
id1	id2	a	b	f
24	24	75	b5	0
25	24	75	b5	0
64	60	33	b3	4.61755
67	61	76	b1	4.86947
67	62	76	b2	4.61755
68	63	76	b7	4.86947
update t10 set b = 'b6' where id1 = 64 and id2 = 60;
SELECT * FROM t10 ORDER BY id1, id2;
id1	id2	a	b	f
24	24	75	b5	0
25	24	75	b5	0
64	60	33	b6	4.61755
67	61	76	b1	4.86947
67	62	76	b2	4.61755
68	63	76	b7	4.86947
update t10 set f = 2.33333 where id1 = 64 and id2 = 60;
SELECT * FROM t10 ORDER BY id1, id2;
id1	id2	a	b	f
24	24	75	b5	0
25	24	75	b5	0
64	60	33	b6	2.33333
67	61	76	b1	4.86947
67	62	76	b2	4.61755
68	63	76	b7	4.86947
update t10 set b = 'b6' where b = 'b7';
SELECT * FROM t10 ORDER BY id1, id2;
id1	id2	a	b	f
24	24	75	b5	0
25	24	75	b5	0
64	60	33	b6	2.33333
67	61	76	b1	4.86947
67	62	76	b2	4.61755
68	63	76	b6	4.86947
update t10 set f = 6.66666 where b = 'b6';
SELECT * FROM t10 ORDER BY id1, id2;
id1	id2	a	b	f
24	24	75	b5	0
25	24	75	b5	0
64	60	33	b6	6.66666
67	61	76	b1	4.86947
67	62	76	b2	4.61755
68	63	76	b6	6.66666

deinit
connection master_1;
DROP DATABASE IF EXISTS auto_test_local;
connection child2_1;
DROP DATABASE IF EXISTS auto_test_remote;
connection child2_2;
DROP DATABASE IF EXISTS auto_test_remote_2;
for master_1
for child2
child2_1
child2_2
child2_3
for child3
child3_1
child3_2
child3_3

end of test
